Reactions, Diffusion and Volume Exclusion in a Heterogeneous System of  Interacting Particles
Lieb-Schultz-Mattis Theorem and its generalizations from the Perspective  of the Symmetry Protected Topological phase
Role of dimensionality in preferential attachment growth in the  Bianconi-Barabási model
Topology and geometry of spin origami
Short note on the density of states in 3D Weyl semimetals
Diagrammatic routes to nonlocal correlations beyond dynamical mean field  theory
Quantum light in curved low dimensional hexagonal boron nitride systems
Driving Topological Phases by Spatially Inhomogeneous Pairing Centers
A simple theory for the dynamics of mean-field-like models of  glass-forming fluids
Maximizing free energy gain
A Discrete-to-Continuum Model of Weakly Interacting Incommensurate  Chains
Energy invariance in capillary systems
Retrieving the quantitative chemical information at nanoscale from SEM  EDX measurements by Machine Learning
Study of the upper-critical dimension of the East model through the  breakdown of the Stokes-Einstein relation
Semimetallic single atomic layer silicon allotrope with Dirac fermions
Wear-resistant thin films of MRI-230D-Mg alloy using plasma-driven  electrolytic oxidation
A strongly correlated metal built from Sachdev-Ye-Kitaev models
Superconducting Properties and $μ$SR Study of the Noncentrosymmetric  Superconductor Nb$_{0.5}$Os$_{0.5}$
Infrared-transmittance tunable metal-insulator conversion device with  thin-film-transistor-type structure on a glass substrate
Simulation Study of Ion Diffusion in Charged Nanopores with Anchored  Terminal Groups
Quantum Monte Carlo simulation of a two-dimensional Majorana lattice  model
Competing spin liquids and hidden nematic order in spin ice with  frustrated transverse exchange
A multiscale approach to liquid crystal nematics via statistical field  theory
Dissociation rates from single-molecule pulling experiments under large  thermal fluctuations or large applied force
Theory of magnetism in La$_2$NiMnO$_6$
Development and properties of composite cement reinforced coconut fiber  with the addition of fly ash
Observation, Evidence and Origin of Room Temperature Magnetodielectric  Effect in Mn doped LaGaO3
Photoinduced charge-order melting dynamics in a one-dimensional  interacting Holstein model
Dynamics of electric charge transport and determination of the  percolation insulator-to-metal transition in polyvinyl-pyrrolidone /  nano-graphene platelet composites
Improved electronic structure and magnetic exchange interactions in  transition metal oxides
Electric properties of carbon nano-onion/polyaniline composites: a  combined electric modulus and ac conductivity study
Magnon spectrum in two- and three- dimensional skyrmion crystals
Anisotropic thermophoresis
Theoretical treatment of anharmonicity of vibrational modes of  single-walled carbon nanotubes
Anharmonicity of vibrational modes in fullerenes
Resonant inelastic x-ray scattering operators for $t_{2g}$ orbital  systems
Higgs mode and its decay in a two dimensional antiferromagnet
Adiabatically tuning quantized supercurrents in an annular Bose-Einstein  condensate
Finite plateau in spectral gap of polychromatic constrained random  networks
Double-Exchange Interaction in Optically Induced Nonequilibrium State: A  Conversion from Ferromagnetic to Antiferromagnetic Structure
Dynamic interdependence and competition in multilayer networks
An Analytical Solution for the Wigner-Boltzmann Transport Equation in  the Relaxation Time Approximation
Interaction-driven Quantum Anomalous Hall Effect in Halogenated Hematite  Nanosheets
Two-dimensional boron on Pb (110) surface
Quasi adiabatic dynamics of energy eigenstates for solvable quantum  system at finite temperature
Angular Dependent Magnetization Dynamics of Kagome Artificial Spin Ice  Incorporating Topological Defects
Sensing ion channels in neuronal networks with graphene transistors
Large linear magnetoresistance in a transition-metal stannide  $β$-RhSn$_4$
Band offsets at amorphous-crystalline $Al_2O_3-SrTiO_3$ oxide interfaces
The role of phase fluctuations in model of superconductivity with the  external pair potential
Automated approaches for band gap mapping in STEM-EELS
Direct exciton emission from atomically thin transition metal  dichalcogenide heterostructures near the lifetime limit
Comparison of dynamic mechanical properties of non-superheated and  superheated A357 alloys
The Effect of Solutes on the Temperature of Miscibility Transitions in  Multi-component Membranes
Pinning effects on self-heating and flux-flow instability in  superconducting films near $T_{c}$
Large Thermoelectric Power Factor at Low Temperatures in One-Dimensional  Telluride Ta4SiTe4
Route from discreteness to the continuum for the non-logarithmic  $q$-entropy
Predictive Simulations for Tuning Electronic and Optical Properties of  SubPc Derivatives
Coulomb interaction driven instabilities of sliding Luttinger liquids
Finite energy spin fluctuation as a pairing glue in systems with  coexisting electron and hole bands
Perturbative Thermodynamic Geometry of Nonextensive Ideal Classical,  Bose and Fermi Gases
Quantum-limited directional amplifiers with optomechanics
Proximity effect and interface transparency in Al/InAs-nanowire/Al  diffusive junctions
Modeling induction period of polymer crystallization
Ferroionic states in ferroelectric thin films
Piezoresponse of ferroelectric films in ferroionic states: time and  voltage dynamics
Quasi one-dimensional metallic band dispersion in the commensurate  charge density wave of $1T$-TaS$_2$
Spontaneous condensation of exciton polaritons in the single-shot regime
Anisotropic hybrid excitation modes in monolayer and double-layer  phosphorene on polar substrates
Spin-1 Bose Hubbard model with nearest neighbour extended interaction
Cycloidal magnetism driven ferroelectricity in double tungstate  LiFe(WO$_4$)$_2$
Hydrodynamic instabilities, waves and turbulence in spreading epithelia
Global phase diagram and quantum spin liquids in spin-1/2 triangular  antiferromagnet
Topological Dirac Nodal-net Fermions in AlB$_2$-type TiB$_2$ and ZrB$_2$
Graphene oxide adsorptive power from better to more via an enhanced  route in perspective
Characterization of Zinc oxide & Aluminum Ferrite and Simulation studies  of M-H plots of Cobalt/Cobaltoxide
Crystal Growth of Cu6(Ge,Si)6O18.6H2O and Assignment of UV-VIS Spectra  in Comparison to Dehydrated Dioptase and Selected Cu(II) Oxo-Compounds  Including Cuprates
Mimicking cuprates: large orbital polarization in a metallic  square-planar nickelate
Master Equations for Electron Transport: The Limits of the Markovian  Limit
Anisotropic plasmons, Friedel oscillations and dynamical screening in  $8-Pmmn$ borophene
High pressure floating-zone growth of perovskite nickelate LaNiO3 single  crystals
Direct optical detection of Weyl fermion chirality in a topological  semimetal
Thermodynamic cost and benefit of data representations
Stiffnessometer, a magnetic-field-free superconducting stiffness meter  and its application
Many-body self-localization in a translation-invariant Hamiltonian
Characterizing the many-body localization transition through the  entanglement spectrum
Topological degeneracy and pairing in a one-dimensional gas of spinless  Fermions
MBE growth of 2H-MoTe2 and 1T'-MoTe2 on 3D substrates
Superconductivity with broken time reversal symmetry in ion irradiated  Ba$_{0.27}$K$_{0.73}$Fe$_2$As$_2$ single crystals
Short Time and Structural Dynamics in Polypropylene Glycol Nanocomposite
Emergence of curved light-cones in a class of inhomogeneous Luttinger  liquids
Selective mass enhancement close to the quantum critical point in  BaFe$_2$(As$_{1-x}$P$_x$)$_2$
Measurement of Surface Acoustic Wave Resonances in Ferroelectric Domains  by Microwave Microscopy
Contrasting the dynamics of elastic and non-elastic deformations across  an experimental colloidal Martensitic transition
Anomalous ^{125}Te Nuclear Spin Relaxation Coincident with Charge Kondo  Behavior in Superconducting Pb_{1-x}Tl_{x}Te
SU(4) Kondo entanglement in double quantum dot devices
Optical selection rules of zigzag graphene nanoribbons
Reversible spin texture in ferroelectric HfO2
Magnetic Field-Free Giant Magnetoresistance in a Proximity- and  Gate-Induced Graphene Spin Valve
Four kinetic energy formulas for studying the interaction of energetic  ions with carbon nanotubes
Room-temperature high detectivity mid-infrared photodetectors based on  black arsenic phosphorus
Carbon Ejection from a SiO2/SiC(0001) Interface by Annealing in  High-Purity Ar
Nodeless superconductivity and the peak effect in the  quasi-skutterudites $\mathrm{Lu}_3\mathrm{Os}_4\mathrm{Ge}_{13}$ and  $\mathrm{Y}_3\mathrm{Ru}_4\mathrm{Ge}_{13}$
(NaCl)_x(KCl)_{y-x}(KBr)_{1-y} single crystals: study of the ac  conductivity activation energy
The Spin-Reorientation Transition in TmFeO3
The dielectric constant of Na_{0.4}K_{0.6}Br and its large temperature  variation
Symmetry-enforced heavy-fermion physics in the quadruple-perovskite  CaCu3Ir4O12
Exact solution for the quench dynamics of a nested integrable system
Activity statistics in a colloidal glass former: experimental evidence  for a dynamical transition
Exact lowest-Landau-level solutions for vortex precession in  Bose-Einstein condensates
LDA+DMFT approach to ordering phenomena and the structural stability of  correlated materials
Driven Brownian particle as a paradigm for a nonequilibrium heat bath:  Effective temperature and cyclic work extraction
Double Andreev Reflections in Type-II Weyl Semimetal-Superconductor  Junctions
An efficient tight-binding mode-space NEGF model enabling up to million  atoms III-V nanowire MOSFETs and TFETs simulations
DMFT study on the electron-hole asymmetry of the electron correlation  strength in the high Tc cuprates
Nucleated dewetting in supported ultra-thin liquid films with  hydrodynamic slip
Planar Hall-effect, Anomalous planar Hall-effect, and Magnetic  Field-Induced Phase Transitions in TaAs
Chopping time of the FPU $α$-model
Water-based and Biocompatible 2D Crystal Inks: from Ink Formulation to  All- Inkjet Printed Heterostructures
A regression-based feature selection study of the Curie temperature of  transition-metal rare-earth compounds: prediction and understanding
Monte Carlo study of the ordering in a strongly frustrated liquid  crystal
Slow spin tunneling in the paramagnetic phase of the pyrochlore Nd2Sn2O7
CP1|1 nonlinear sigma model vs strong electron correlations
Spin-dependent thermoelectric phenomena in a quantum dot attached to  ferromagnetic and superconducting electrodes
Computation of the unifying thread in high temperature superconductors  from first principles quantum Monte Carlo
Supersolidity of lattice Bosons immersed in strongly correlated Rydberg  dressed atoms
On the density of states of circular graphene quantum dots
Effect of instantaneous and continuous quenches on the density of  vibrational modes in model glasses
Machine learning reveals orbital interaction in crystalline materials
Twisting with a twist: supramolecular helix fluctuations in chiral  nematics
Impact of rough potentials in rocked ratchet performance
Charge and energy fractionalization mechanism in one-dimensional  channels
Topolectrical circuits
Strongly interaction-enhanced valley magnetic response in monolayer WSe2
Comparison of Gabay-Toulouse and de Almeida-Thouless instabilities for  the spin glass XY model in a field on sparse random graphs
Gapless edges of 2d topological orders and enriched monoidal categories
Robust pinning of magnetic moments in pyrochlore iridates
Duality and Universal Transport in a Mixed-Dimension Electrodynamics
Symmetry and duality in bosonization of two-dimensional Dirac fermions
Towards understanding two-level-systems in amorphous solids - Insights  from quantum circuits
Weyl and Dirac Semimetals in Three Dimensional Solids
Amplitude-dependent topological edge states in nonlinear phononic  lattices
Theory of optically controlled anisotropic polariton transport in  semiconductor double microcavities
Edge Trapping of Exciton-Polariton Condensates in Etched Pillars
Unconventional slowing down of electronic recovery in photoexcited  charge-ordered La$_{1/3}$Sr$_{2/3}$FeO$_3$
Unveiling the mystery of nucleation and growth of carbon nanotubes in a  pure carbon-arc
Non-collinear magnetic structure and multipolar order in  Eu$_2$Ir$_2$O$_7$
Tomonaga-Luttinger spin liquid in the spin-1/2 inequilateral  diamond-chain compound K$_3$Cu$_3$AlO$_2$(SO$_4$)$_4$
de Almeida-Thouless instability in short-range Ising spin-glasses
Evanescent-wave Johnson Noise in small devices
Boosting the discovery of 3D topological materials: mixing chemistry  with physics via a two-step computational screening strategy
Spectroscopy of multi-electrode tunnel barriers
Tunneling Field-Effect Junctions with WS$_2$ barrier
Dependence of homogeneous crystal nucleation in water droplets on their  radii and its implication for modeling the formation of ice particles in  cirrus clouds
Single array of magnetic vortex disks uses in-plane anisotropy to create  different logic gates
Physical description of nature from a system-internal viewpoint
Quaternary two-dimensional (2D) transition metal dichalcogenides (TMDs)  with tunable bandgap
High resolution Monte Carlo study of the Domb-Joyce model
Spin Resonance and Magnetic Order in an Unconventional Superconductor
Spinon confinement in a quasi one dimensional anisotropic Heisenberg  magnet
Multiphased alkali halide mixed crystals: The conductivity activation  energy
Quantum simulators by design - many-body physics in reconfigurable  arrays of tunnel-coupled traps
Microscopic bosonization of band structures: X-ray processes beyond the  Fermi edge
Low frequency Raman spectroscopy of few-atomic-layer thick hBN crystals
Strain-induced polar discontinuities in 2D materials from combined  first-principles and Schrödinger-Poisson simulations
Relation between Kitaev magnetism and structure in $α$-RuCl$_3$
Anomalous spin precession under a geometrical torque
Sub-atomic electronic feature from dynamic motion of Si dimer defects in  bismuth nanolines on Si(001)
Anisotropic Exchange in ${\bf LiCu_2O_2}$
Superstructure evolution of tellurium atoms on Au(111) surface at  different coverages
Synthetic ferrimagnet spin transfer torque oscillator: model and  non-linear properties
Current driven second harmonic domain wall resonance in ferromagnetic  metal/ nonmagnetic metal bilayer: a field-free method for spin Hall angle  measurements
Brownian forgery of statistical dependences
Robust valley polarization of helium ion modified atomically thin  MoS$_{2}$
Brownian systems with spatially inhomogeneous activity
Thermal Conductivity of PAAm Hydrogel and its Crosslinking Effect
Efficient production of long-lived ultracold Sr$_2$ molecules
Hourglass Dirac Chain Metal in Rhenium Dioxide
Electron-Hole Symmetry Breaking in Charge Transport in Nitrogen-Doped  Graphene
Lattice-layer entanglement in Bernal-stacked bilayer graphene
Canonical-ensemble extended Lagrangian Born-Oppenheimer molecular  dynamics for the linear scaling density functional theory
Achieving High Fidelity Single Qubit Gates in a Strongly Driven Silicon  Quantum Dot Hybrid Qubit
First principles study of bimetallic Ni$_{13-n}$Ag$_n$ nano-clusters ($n  =$ 0$-$13) : Structural, mixing, electronic and magnetic properties
Nematic phase with colossal magnetoresistance and orbital polarons in  manganite La$_{1-x}$Sr$_x$MnO$_3$
Microwave control of coupling parameters in spinor alkali condensates
Epitaxy of Advanced Nanowire Quantum Devices
CoFFEE: Corrections For Formation Energy and Eigenvalues for charged  defect simulations
Magnetic excitations and amplitude fluctuations in insulating cuprates
Theory of Ultra Low Tc Superconductivity in Bismuth: Tip of an Iceberg ?
Structure and lattice dynamics of the wide band gap semiconductors  MgSiN$_{2}$ and MgGeN$_{2}$
Universal self-assembly of one-component three-dimensional dodecagonal  quasicrystals
Superconducting fluctuations in a thin NbN film probed by the Hall  effect
Nonlinear response theory for Markov processes II: Fifth-order response  functions
A Spatial Structural Derivative Model for Ultraslow Diffusion
Two-terminal transport along a proximity induced superconducting quantum  Hall edge
Gapless Symmetry Protected Topological Order
Quantum phase transitions driven by rhombic-type single-ion anisotropy  in the S=1 Haldane chain
Dimensional Crossover of Charge-Density Wave Correlations in the  Cuprates
Changes in charge density vs changes in formal oxidation states: The  case of Sn halide perovskites and their ordered vacancy analogues
Large optical conductivity of Dirac semimetal Fermi arc surfaces states
Reversal of thermoelectric current in tubular nanowires
Vortex core order and field-driven phase coexistence in the attractive  Hubbard model
Controlling Chiral Domain Walls in Antiferromagnets Using Spin-Wave  Helicity
Linearly polarized GHz magnetization dynamics of spin helix modes in the  ferrimagnetic insulator Cu$_{2}$OSeO$_{3}$
Memory Effects in Active Particles with Exponentially Correlated  Propulsion
Wallpaper Fermions and the Nonsymmorphic Dirac Insulator
Magnetic properties of Dy nano-islands on graphene
Cusp-shaped Elastic Creases and Furrows
Pressure and Flow of Exponentially Self-Correlated Active Particles
Electron doped layered nickelates: spanning the phase diagram of the  cuprates
Longitudinal negative magnetoresistance and magneto-transport phenomena  in conventional and topological conductors
Zitterbewegung in time-reversal Weyl Semimetals
Picometer-scale atom position analysis in annular bright-field STEM  imaging
Ab initio study of sodium cointercalation with diglyme molecule into  graphite
Orbital optimization in the perfect pairing hierarchy. Applications to  full-valence calculations on linear polyacenes
Anomalous Acoustic Plasmon Mode from Topologically Protected States
Molecularly-thin anatase field-effect transistors fabricated through the  solid state transformation of titania nanosheets
Phase-space mixing in dynamically unstable, integrable few-mode quantum  systems
Exact analysis of gate noise effects on non-adiabatic transformations of  spin-orbit qubits
Nematic Skyrmions in Odd-Parity Superconductors
Entropy-limited topological protection of skyrmions
Superconductor to weak-insulator transitions in disordered Tantalum  Nitride films
Intrinsic energy conversion mechanism via telescopic extension and  retraction of concentric carbon nanotubes
Physics of the Kitaev model: fractionalization, dynamical correlations,  and material connections
Classifying parafermionic gapped phases using matrix product states
Dissipative Rabi model for deep strong far-off-resonant driving
Electronic transport in metallic carbon nanotubes with mixed defects  within the strong localization regime
Polytypism in the ground state structure of the Lennard-Jonesium
Reply to "Rescuing the MaxEnt treatment for $q$-generalized entropies"  by A. Plastino and M.C. Rocca
Influence of defect-induced deformations on electron transport in carbon  nanotubes
Thermalization of isolated Bose-Einstein condensates by dynamical heat  bath generation
Unconventional magnetic order in the conical state of MnSi
Strong localization in defective carbon nanotubes: a recursive Green's  function study
Active elastohydrodynamics of vesicles in narrow, blind constrictions
Characterization of nonequilibrium states of trapped Bose-Einstein  condensates
Charging of highly resistive granular metal films
A versatile scanning photocurrent mapping system to characterize  optoelectronic devices based on 2D materials
Ising anyonic topological phase of interacting Fermions in one dimension
103-Compound Band Structure Benchmark of Post-SCF Spin-Orbit Coupling  Treatments in Density-Functional Theory
Equation of state and self-bound droplet in Rabi-coupled Bose mixtures
Microscopic models for uphill diffusion
Topological Phase Transition and Charge Pumping in a One-Dimensional  Periodically Driven Optical Lattice
Short-range order in high entropy alloys:Theoretical formulation and  application to Mo-Nb-Ta-V-W system
Photoinduced Domain Pattern Transformation in Ferroelectric/Dielectric  Superlattices
Theory of Linear Spin Wave Emission from a Bloch Domain Wall
Density and spin modes in imbalanced normal Fermi gases from  collisionless to hydrodynamic regime
Enhancement of the upper critical field in disordered transition metal  dichalcogenide monolayers
Turbulence scaling laws across the superfluid to supersolid transition
Mechanism for unconventional superconductivity in the hole-doped  Rashba-Hubbard model
Induced density correlations in a sonic black hole condensate
A Strange Metal from Gutzwiller correlations in infinite dimensions II:  Transverse Transport, Optical Response and Rise of Two Relaxation Rates
Field-free deterministic ultra fast creation of skyrmions by spin orbit  torques
Machine Learning $\mathbb{Z}_{2}$ Quantum Spin Liquids with  Quasi-particle Statistics
Induced spin-triplet pairing in the coexistence state of  antiferromagnetism and singlet superconductivity: collective modes and  microscopic properties
Many-body localization transition through pairwise correlations
Phonon limited thermoelectric transport in Pb
Tight Binding Parametrization of Few-layer Black Phosphorus from  First-Principles Calculations
Exciton-phonon interaction in the strong coupling regime in hexagonal  boron nitride
Combined effect of doping and temperature on the anisotropy of  low-energy plasmons in monolayer graphene
Application of Finite Element, Phase-field, and CALPHAD-based Methods to  Additive Manufacturing of Ni-based Superalloys
Graphene-based amplification and tuning of near-field radiative heat  transfer between dissimilar polar materials
Transition from turbulent to coherent flows in confined  three-dimensional active fluids
Crystalline ordering and large fugacity expansion for hard core lattice  particles
Near-unity quantum yield from carbon nanotube excitons coupled to  plasmonic nanocavities
Andreev bound states versus Majorana bound states in quantum  dot-nanowire-superconductor hybrid structures: Trivial versus topological  zero-bias conductance peaks
Quantum gas microscopy of an attractive Fermi-Hubbard system
Nonequilibrium quantum dynamics of partial symmetry breaking for  ultracold bosons in an optical lattice ring trap
Semiclassical Model for Calculating Exciton and Polaron Pair Energetics  at Interfaces
Probing the phonon surface interaction by wave packet simulation: effect  of roughness and morphology
Probing the superconducting gap symmetry of $α$-PdBi$_{2}$: A  penetration depth study
Solving Spin Glasses with Optimized Trees of Clustered Spins
Type-II nodal loops: theory and material realization
MOVPE growth, transmission electron microscopy and magneto-optical  spectroscopy of individual InAsP/GaInP quantum dots
Thermographic measurements of the spin Peltier effect in  metal/yttrium-iron-garnet junction systems
A connection between non-local one-body and local three-body  correlations of the Lieb-Liniger model
Charged excitons in monolayer WSe$_2$: experiment and theory
First-principles molecular transport calculation for the  benzenedithiolate molecule
Quantum dynamics of bosons in a two-ring ladder: dynamical algebra,  vortex-like excitations and currents
Role of curvature and domain shape on Turing patterns
Electrical single spin read-out using an exchange-coupled quantum dot
Geometry-driven collective ordering of bacterial vortices
Photoinduced topological phase transition from a crossing-line nodal  semimetal to a multiple-Weyl semimetal
Unusual ferroelectric and magnetic phases in multiferroic 2H-BaMnO$_3$  ceramics
Hydrodynamics defines the stable swimming direction of spherical  squirmers in a nematic liquid crystal
Continuum of many-particle states near the metal-insulator transition in  the Hubbard model
Neutron-scattering study of yttrium iron garnet
Decondensation in non-equilibrium photonic condensates: when less is  more
X-ray Magnetic and Natural Circular Dichroism from first principles:  Calculation of K- and L1-edge spectra
Atomic-scale modeling of twinning disconnections in zirconium
Highly hydrogen-sensitive thermal desorption spectroscopy system for  quantitative analysis of low hydrogen concentration (~1 x 10^16 atoms/cm3) in  thin-film samples
Time-reversal-symmetric topological magnetoelectric effect in  three-dimensional topological insulators
Hydrodynamic and entropic effects on colloidal diffusion in corrugated  channels
The Linear and Non-linear Magnetic Response of a Tri-Uranium Single  Molecule Magnet
Fermi points and the Nambu sum rule in the polar phase of $^3$He
Berezinskii-Kosterlitz-Thouless Type Scenario in Molecular Spin Liquid  $A$Cr$_2$O$_4$
Optical conductivity of three and two dimensional topological nodal line  semimetals
Electronic band gaps of confined linear carbon chains ranging from  polyyne to carbyne
Light-induced anisotropic skyrmion and stripe phases in a Rashba  ferromagnet
Environmental noise spectroscopy with qubits subjected to dynamical  decoupling
Nano-patterned magnonic crystals based on ultrathin YIG films
Cyclization of Short DNA Fragments
Non-stationary spin-filtering effects in correlated quantum dot
Electronic anisotropies revealed by detwinned ARPES measurements of FeSe
Nanostructured complex oxides as a route towards thermal behavior in  artificial spin ice systems
Non-Perturbative Electron Counting Statistics
Unexpected Enhancement of Three-Dimensional Low-Energy Spin Correlations  in Quasi-Two-Dimensional Fe$_{1+y}$Te$_{1-x}$Se$_{x}$ System at High  Temperature
Penetration of fast projectiles into resistant media: from macroscopic  to subatomic projectiles
