Characterizations of topological superconductors: Chern numbers, edge  states and Majorana zero modes
Superconducting pairing in Sr$_2$RuO$_4$ from weak to intermediate  coupling
Electron spectral functions in a quantum dimer model for topological  metals
Static and dynamic scaling behavior of a polymer melt model with  triple-well bending potential
Effects of pressure on suspended micromechanical membrane arrays
Tailoring Magnetic Skyrmions by Geometric Confinement of Magnetic  Structures
Stacking change in MoS$_{2}$ bilayers induced by interstitial Mo  impurities
Thermal runaway of metal nano-tips during intense electron emission
Tuning the antiferromagnetic helical pitch length and nanoscale domain  size in Fe$_3$PO$_4$O$_3$ by magnetic dilution
First-principles study of MoS$_2$ and MoSe$_2$ nanoclusters in the  framework of evolutionary algorithm and density functional theory
Finite-Range Coulomb Gas Models of Banded Random Matrices and Quantum  Kicked Rotors
Large anomalous Nernst effect at room temperature in a chiral  antiferromagnet
Dial-in Topological Metamaterials Based on Bistable Stewart Platform
Spatial Heterogeneities and Onset of Passivation Breakdown at Lithium  Anode Interfaces
Pinning of Diffusional Instabilities by Non-Uniform Curvature
Dynamics of Symmetry-Breaking Stacking Boundaries in Bilayer MoS2
Electrical Control of Linear Dichroism in Black Phosphorus from the  Visible to Mid-Infrared
Fermionic Matrix Product States and One-Dimensional Short-Range  Entangled Phases with Anti-Unitary Symmetries
On the Long-Range Exciton Transport in H-Aggregated Heterotriangulene  Chains
Boson peak dynamics of glassy glucose studied by integrated  terahertz-band spectroscopy
Correlations and hyperuniformity in the avalanche size of the Oslo Model
Molecular packing, hydrogen bonding, and fast dynamics in  lysozyme/trehalose/glycerol and trehalose/glycerol glasses at low hydration
Insulating-to-Conducting Behavior and Band Profile Across the  La0.9Ba0.1MnO3/Nb:SrTiO3 Epitaxial Interface
Interplay of Kondo Effect and RKKY Interaction
Nonequilibrium Green's function theory for nonadiabatic effects in  quantum electron transport
Exotic superfluidity and pairing phenomena in atomic Fermi gases in  mixed dimensions
Free energy of a folded polymer under cylindrical confinement
Tuning the diffusion of magnon in Y3Fe5O12 by light excitation
Anion order and spontaneous polarization in LaTiO\textsubscript{2}N  oxynitride thin films
Fermionic statistics in the strongly correlated limit of Density  Functional Theory
Bending mode and thermal expansion of graphene
On the phase diagram of Mackay icosahedra
Elasticity in the Gauge Theory of Active Nematics with Topological  Defects
First-principles Engineering of Charged Defects for Two-dimensional  Quantum Technologies
Dimensional crossover and incipient quantum size effects in  superconducting niobium nanofilms
The viscosity-radius relationship from scaling arguments
Dimensional crossover in the quasi-one-dimensional superconductor  Tl$_2$Mo$_6$Se$_6$
Slater Insulator in Iridate Perovskites with Strong Spin-Orbit Coupling
Quartic Anharmonicity of Rattlers and Its Effect on Lattice Thermal  Conductivity of Clathrates from First Principles
Theory of ground states for classical Heisenberg spin systems IV
Topological Dirac states beyond $π$ orbitals for silicene on SiC(0001)  surface
Low-lying energy levels of a one-dimensional weakly interacting Bose gas  under zero boundary conditions
Investigation of in-plane nuclear field formation in single  self-assembled quantum dots
Current-controlled light scattering and asymmetric plasmon propagation  in graphene
Ultrafast Electronic Dynamics of a Weyl Semimetal MoTe$_2$ Revealed by  Time and Angle Resolved Photoemission Spectroscopy
Pulsating flow and boundary layers in viscous electronic hydrodynamics
Microscopic Marangoni flows cannot be predicted on the basis of pressure  gradients
Quantum critical singularities in two-dimensional metallic XY  ferromagnets
Helical edge transport in the presence of a magnetic impurity
Structure diagram of binary Lennard-Jones clusters
Time-Reversal Symmetry-Breaking Nematic Insulators near Quantum Spin  Hall Phase Transitions
Realization of the Axion Insulator State in Quantum Anomalous Hall  Sandwich Heterostructures
Pressure-induced Superconductivity in the Three-component Fermion  Topological Semimetal Molybdenum Phosphide
Observation of half-integer thermal Hall conductance
Heating and thermoelectric transport in a molecular junction
Quantum point contact: a case of spin-resolved electron transport
Magnetization plateaus in the spin-1/2 antiferromagnetic Heisenberg  model on a kagome-strip chain
Nonlinear, anisotropic and giant photoconductivity in intrinsic and  doped graphene
Cooling schemes for two-component fermions in layered optical lattices
Signatures of van der Waals binding: a coupling-constant scaling  analysis
Circular-Polarization-Dependent Study of Microwave-Induced Conductivity  Oscillations in a Two-Dimensional Electron Gas on Liquid Helium
Reciprocal space mapping of magnetic order in thick epitaxial MnSi films
Response of the Higgs amplitude mode of superfluid Bose gases in a three  dimensional optical lattice
Anomalous magnetotransport properties of high-quality single crystals of  Weyl semimetal WTe2: Sign change of Hall resistivity
Raman spectroscopy of femtosecond multi-pulse irradiation of vitreous  silica: experiment and simulation
Quantum Multicriticality in Disordered Weyl Semimetal
Multi-scale modelling of current-induced switching in magnetic tunnel  junctions using ab initio spin transfer torques
Multilevel effects in a driven generalized Rabi model
Electron and hole g-factors and spin dynamics of negatively charged  excitons in CdSe/CdS colloidal nanoplatelets with thick shells
Ultra-Low-Energy Straintronics Using Multiferroic Composites
Superconducting quantum point contact with split gates in the two  dimensional LaAlO3/SrTiO3 superfluid
Pressure and strain effects on the optical properties of K4 phosphorus
Bistable Transport Properties of a Quasi-One-Dimensional Wigner Solid on  Liquid Helium under Continuous Driving
Role of three-particle vertex within dual fermion calculations
Functional Renormalization Group and Kohn-Sham scheme in Density  Functional Theory
Matrix- and tensor-based recommender systems for the discovery of  currently unknown inorganic compounds
Intermittency and emergence of coherent structures in wave turbulence of  a vibrating plate
The ferroelectric domain wall phonon polarizer
Cooling jug physics
Signatures of low-energy fractionalized excitations in $α$-RuCl$_3$  from field-dependent microwave absorption
Thermodynamic geometry for a non-extensive ideal gas
Multistable Dissipative Breathers and Novel Collective States in SQUID  Lieb Metamaterials
Metastability at the Yield-Stress Transition in Soft Glasses
Spin liquid state in an inhomogeneous periodic Anderson model
Soft yet sharp interfaces in a vertex model of confluent tissue
Magnetic phase transitions and unusual antiferromagnetic states in the  Hubbard model
High Controllable and Robust 2D Spin-Orbit Coupling for Quantum Gases
Topologically protected Landau level in the vortex lattice of a Weyl  superconductor
Algebraic Time Crystallization in a Two-dimensional Superfluid
Localized Control of Curie Temperature in Perovskite Oxide Film by  Capping-layer- induced Octahedral Distortion
Ultrafast Molecular Transport on Carbon Surfaces: The Diffusion of  Ammonia on Graphite
A quantum-dot heat engine operating close to the thermodynamic  efficiency limits
Symmetry enriched U(1) quantum spin liquids
Polaronic and dressed molecular states in orbital Feshbach resonances
Investigation of the electronic properties of the surface and bulk forms  of gold and palladium
Entropy Driven Molecular Motion of Semiconducting Polymers in Solution
The impacts of the quantum-dot confining potential on the spin-orbit  effect
Jarzynski Equality for Driven Quantum Field Theories
Multiple-scale structures: from Faraday waves to soft-matter  quasicrystals
Nonlocal Andreev Entanglements and Triplet Correlations in Graphene with  Spin Orbit Coupling
Phase transitions of polariton condensate in 2D Dirac materials
Higher-dimensional SYK Non-Fermi Liquids at Lifshitz transitions
Artificial gauge fields in materials and engineered systems
Electrical resistivity across the tricriticality in itinerant  ferromagnet
Near-infrared intersubband photodetection in GaN/AlN nanowires
Accurate computations of Rashba spin-orbit coupling in interacting  systems: from the Fermi gas to real materials
Transient and Sharvin resistances of Luttinger liquids
Band Topology and Dichroic Signature of Bismuth
Distinct differences in the nanoscale behaviors of the twist-bend liquid  crystal phase of a flexible linear trimer and homologous dimer
Two-dimensional plasmons in the random impedance network model of  disordered thin-film nanocomposites
Temperature- dependence of anomalous Hall conductivity in Rashba-type  ferromagnets
Identifying optical signatures of momentum-dark excitons in transition  metal dichalcogenide monolayers
The role of momentum-dark excitons in the elementary optical response of  bilayer WSe$_{2}$
Cavity-control of bright and dark interlayer excitons in van der Waals  heterostructures
Nonlinear Phononic Control and Emergent Magnetism in Mott Insulating  Titanates
Data Pipeline Development for Grain Boundary Structures Classification
Ring and linear copolymer blends under confinement
Kosterlitz-Thouless signatures in the low-temperature phase of layered  three-dimensional systems
Search for Thermoelectrics with High Figure of Merit in half-Heusler  compounds with multinary substitution
Low dose X-ray speckle visibility spectroscopy reveals nanoscale  dynamics in radiation sensitive ionic liquids
Spin-wave chirality and its manifestations in antiferromagnets
Five-dimensional imaging of freezing emulsions with solute effects
Flexoelectricity induced spatially modulated phases in ferroics and  liquid crystals (Author review)
Chemical vapor deposition growth of bilayer graphene in between  molybdenum disulfide sheets
Long-range dynamical magnetic order and spin tunneling in the  cooperative paramagnetic states of the pyrochlore analogous spinel  antiferromagnets CdYb2X4 (X = S, Se)
Trapping/Pinning of colloidal microspheres over glass substrate using  surface features
Heat current through an artificial Kondo impurity beyond linear response
Model charged cylindrical nanopore in a colloidal dispersion: charge  reversal, overcharging and double overcharging
Stable oil-laden foams: Formation and evolution
Liquid metals: early contributions and some recent developments
Charge storage in nanotubes: the case of a 2-1 electrolyte
Chern Insulator Phase in a Lattice of an Organic Dirac Semimetal with  Intracellular Potential and Magnetic Modulations
New solid phase of dipolar systems
When is a surface foam-phobic or foam-philic?
On the improvement of SPT2 approach in the theory of a hard sphere fluid  in disordered porous media
Correlation functions and thermophysical properties of one-dimensional  liquids
Redirection of a crack driven by viscous fluid
Boundary layer coupling of solid particles in water in an ultrasonic  field
Effect of chain length distribution on mechanical behavior of polymeric  networks
Large thermoelectric figure of merit in graphene layered devices at low  temperature
Generalized Schrieffer-Wolff transformation of multi-flavor Hubbard  models
meV resolution in laser-assisted energy-filtered transmission electron  microscopy
Nonlocal electrical detection of spin accumulation generated by  Anomalous Hall effects in mesoscopic Ni_81Fe_19 films
Isobaric-isothermal molecular dynamics computer simulations of the  properties of water-1,2-dimethoxyethane model mixtures
From the bulk electrolyte solution to the electrochemical interface
Buckling of elastic filaments by discrete magnetic moments
d-zero Magnetism in Nanoporous Amorphous Alumina Membranes
Cathodoluminescence as an Effective Probe of Carrier Transport and Deep  Level Defects in Droop-Mitigating InGaN/GaN Quantum Well Heterostructures
Perturbation theory approaches to Anderson and Many-Body Localization:  some lecture notes
Light-cones and quantum caustics in quenched spin chains
Theory of a quantum spin liquid in hydrogen-intercalated honeycomb  iridate, H3LiIr2O6
Heat transfer in a one-dimensional harmonic crystal in a viscous  environment subjected to an external heat supply
Band Structure Engineering of 2D Materials using Patterned Dielectric  Superlattices
Size-dependent bandgap and particle size distribution of colloidal  semiconductor nanocrystals
Dynamics of the relativistic Gross-Pitaevskii equation with harmonic  potential: Following the variational approach
Free expansion of Bose-Einstein condensates with a multicharged vortex
Lagrangian formulation and symmetrical description of liquid dynamics
Orbital Effect of the Magnetic Field in Dynamical Mean-Field Theory
Response of the lattice across the filling-controlled Mott  metal-insulator transition of a rare earth titanate
Thermoelectric transport properties in graphene connected molecular  junctions
Giant Casimir non-equilibrium forces drive coil to globule transition in  polymers
The response of jammed packings to thermal fluctuations
Cryogenic positioning and alignment with micrometer precision
Unified bulk-boundary correspondence for band insulators
Nondiffusive thermal transport from micro/nanoscale sources producing  nonthermal phonon populations exceeds Fourier heat conduction
The Mechanism of Electrolyte Gating on High-Tc Cuprates: The Role of  Oxygen Migration and Electrostatics
ZnO Defect Modulation for Efficient Photocatalysis
Pseudogap regime of a two-dimensional uniform Fermi gas
Imaging resonant dissipation from individual atomic defects in graphene
Generalization of exactly-solvable model to exhibit solid-fluid phase  transition in crystal structures with two particles in a primitive cell
Magnetometry with low resistance proximity Josephson junction
Proof of bulk charge ordering in the CuO$_2$ plane of the cuprate  superconductor YBa$_2$Cu$_3$O$_{6.9}$ by high pressure NMR
Lee-Yang zeros and large-deviation statistics of a molecular zipper
Ferromagnetic order in dipolar systems with anisotropy: application to  magnetic nanoparticle supracrystals
Possible evidence for spin-transfer torque induced by spin-triplet  supercurrent
Charge reversal and surface charge amplification in asymmetric valence  restricted primitive model planar electric double layers in the modified  Poisson-Boltzmann theory
On low eigevalues of the entanglement Hamiltonian, localization length,  and rare regions in disordered interacting one-dimensional systems
Effects of porosity in a model of corrosion and passive layer growth
Self-assembled metallic nanoparticle template --- a new approach of  surface nanostructuring at nanometer scale
Scaling analysis of the extended single impurity Anderson model:  Renormalization due to valence fluctuations
Tracking a hysteretic and disorder-broadened phase transition via the  electromagnon response in improper ferroelectrics
A phononic switch based on ferroelectric domain walls
1305 nm MoTe2-on-silicon Laser
Kinetic Field Theory: Exact free evolution of Gaussian phase-space  correlations
From Kondo to local singlet state in graphene nanoribbons with magnetic  impurities
Electrical and Hydrogen Reduction Enhances Kinetics in Doped Zirconia  and Ceria: II. Mapping Electrode Polarization and Vacancy Condensation in YSZ
Hamiltonian transformation to compute Thermo-osmotic Forces
Phase transitions in quasi-one dimensional system with unconventional  superconductivity
Random walks in disordered lattice, CTRW, memory and dipole transport
Domain-wall excitations in the two-dimensional Ising spin glass
Suppression of the overlap between Majorana fermions by orbital magnetic  effects in semiconducting-superconducting nanowires
Magnetic and electronic phase crossovers in graphene nanoflakes
Tailoring the electronic properties of Ca$_2$RuO$_4$ via epitaxial  strain
Mechanical properties of superhard boron subnitride B13N2
Bloch oscillations in graphene from an artificial neural network study
Emergence of junction dynamics in a strongly interacting Bose mixture
Resolution of the exponent puzzle for the Anderson transition in doped  semiconductors
Topological Entanglement Entropy of Fracton Stabilizer Codes
Structure of the Entanglement Entropy of (3+1)D Gapped Phases of Matter
Dual characterization of critical fluctuations: Density functional  theory & nonlinear dynamics close to a tangent bifurcation
Diversity of charge orderings in correlated systems
Supergiant barocaloric effects in acetoxy silicone rubber around room  temperature
Entanglement branching operator
First-principles and model simulation of all-optical spin reversal
Revisiting the Deformation-Induced Damage in Filled Elastomers: Effect  of Network Polydispersity
Part-per-million quantization and current-induced breakdown of the  quantum anomalous Hall effect
Infinite number of solvable generalizations of XY-chain, with cluster  state, and with central charge c=m/2
Probing the Chiral Anomaly by Planar Hall Effect in Three-dimensional  Dirac Semimetal Cd3As2 Nanoplates
Motion of grain boundaries incorporating dislocation structure
Lattice and Magnetic Effects on a d-d Excitation in NiO Using a 25 meV  Resolution X-ray Spectrometer
Electronic Transport Properties of Carrier Controlled SnSe Single  Crystals
Electric field Control of Exchange Bias by Resistive Switching
Whether it is possible to stabilize the 1144-phase pnictides with  tri-valence cations?
Stationary mass distribution and nonlocality in models of coalescence  and shattering
Many-body topological invariants for fermionic short-range entangled  topological phases protected by antiunitary symmetries
Emergence of Lévy walks from second order stochastic optimization
Noise-induced drift in two-dimensional anisotropic systems
Theoretical model for plasmonic photothermal response of gold  nanostructures solutions
Comparative study of one-dimensional Bose and Fermi gases with contact  interactions from the viewpoint of universal relations for correlation  functions
Caveats of mean first-passage time methods applied to the  crystallization transition: effects of non-Markovianity
On the reaction coordinate for seeded crystallisation
Gauge field entanglement of Kitaev's honeycomb model
Importance of van der Waals interactions and cation-anion coupling in an  organic quantum spin liquid
Dual-wavelength Photo-Hall effect spectroscopy of deep levels in high  resistive CdZnTe with negative differential photoconductivity
Surface and 3D quantum Hall effects from engineering of exceptional  points in nodal-line semimetals
Selective Hydrogen Adsoprtion in Graphene Rotated Bilayers
Velocity gradient power functional for Brownian dynamics
Magnetic properties of monoclinic lanthanide orthoborates, $Ln$BO$_3$,  $Ln$ = Gd, Tb, Dy, Ho, Er, Yb
Subdiffusive Transport in Heterogeneous Patchy Environments
The ab initio study of unconventional superconductivity in CeCoIn$_{5}$  and FeSe
Network approach towards understanding the crazing in glassy amorphous  polymers
On the bulk boundary correspondence and the existence of Majorana bound  states on the edges of 2D topological superconductors
Excited states of defect lines in silicon: A first-principles study  based on hydrogen cluster analogues
Network topology in soft gels: hardening and softening materials
Absence of confinement in (SrTiO3)/(SrTi0:8Nb0:2O3) superlattices
Stochastic model for the 3D microstructure of pristine and cyclically  aged cathodes in Li-ion batteries
Exchange coupling and Mn valency in GaN doped with Mn and co-doped with  Mg
Dirac and topological phonons with spin-orbital entangled orders
Multi-scale Modeling of Plasticity Nearby Precipitates in Nanostructured  Materials
Delocalization of charge and current in a chiral quasiparticle  wave-packet
Transport theory for femtosecond laser-induced spin-transfer torques
First-principles investigation of competing magnetic interactions in  (Mn,Fe)Ru$_2$Sn Heusler solid solutions
Second-harmonic phonon spectroscopy of $α$-quartz
Spin Hall and Nernst effects of Weyl magnons
Controlled parity switch of persistent currents in quantum ladders
Is charge order induced near an antiferromagnetic quantum critical  point?
Creation of spin-triplet Cooper pairs in the absence of magnetic  ordering
Direct visualization of phase separation between superconducting and  nematic domains in Co-doped CaFe2As2 close to a first order phase transition
Collective modes of Dirac and Weyl semimetals in strong magnetic fields
Magnetic Skyrmionic Polarons
Understanding three-body contributions to coarse-grained force-fields
Direct Measurement of Anharmonic Decay Channels of a Coherent Phonon
Correlation-induced refrigeration with superconducting single-electron  transistors
Engineering Enhanced Thermal Transport in Layered Nanomaterials
Superstatistical generalised Langevin equation: non-Gaussian  viscoelastic anomalous diffusion
Efficient Reactive Brownian Dynamics
Quantum versus classical effects at zero and finite temperature in the  quantum pyrochlore Yb$_2$Ti$_2$O$_7$
Tunneling statistics for analysis of spin-readout fidelity
Geometry of wave propagation on active deformable surfaces
Spectral Weight of Resonant Inelastic X-Ray Scattering in Doped  Cuprates: Effect of Core-Hole Lifetime
Energy transport in the presence of long-range interactions
Two distinct superconducting pairing states divided by the nematic end  point in FeSe$_{1-x}$S$_{x}$
Diffusion dynamics and steady states of systems of hard rods on the  square lattice
Third-order optical conductivity of an electron fluid
Ultralow and Anisotropic Thermal Conductivity in Semiconductor As2Se3
Exotic states of matter with polariton chains
Liquid crystalline behaviour of self-assembled Laponite PLL-PEG  nanocomposites
Heat and work in Markovian quantum master equations: concepts,  fluctuation theorems, and computations
Global anomaly detection in two-dimensional symmetry-protected  topological phases
Supercurrent as a Probe for Topological Superconductivity in Magnetic  Adatom Chains
Atomistic simulations on ductile-brittle transition in <111> BCC Fe  nanowires
Relaxation of a nonequilibrium phonon distribution induced by  femtosecond laser irradiation
Work probability distribution for a ferromagnet with long-ranged and  short-ranged correlations
Paraconductivity of pseudogapped superconductors
Zn-induced in-gap electronic states in La214 probed by uniform magnetic  susceptibility: relevance to the suppression of superconducting Tc
Non-degenerate valleys in the half-metallic ferromagnet Fe/WS$_2$
Annealing cycles and the self-organization of functionalized colloids
Recovering the flat-plane condition in electronic structure theory at  semi-local DFT cost
Origin of Ferroelectricity in Orthorhombic LuFeO$_3$
Metallic supercurrent field-effect transistor
3d Transition Metals and Oxides within Carbon Nanotubes by Co-Pyrolysis  of Metallocene & Camphor: High Filling Efficiency and Self-Organized  Structures
Droplet transport in a nanochannel coated by hydrophobic semiflexible  polymer brushes: the effect of chain stiffness
Observation of Wannier-Stark localization at the surface of BaTiO$_3$  films by photoemission
Effective Three-Body Interactions in Jaynes-Cummings-Hubbard Systems
Investigation of the interfacial Dzyaloshinskii-Moriya interaction sign  in Ir/Co2FeAl systems by Brillouin light scattering
Superlattice switching from parametric instabilities in a  driven-dissipative BEC in a cavity
Ordering transitions of weakly anisotropic hard rods in narrow slit-like  pores
Auxetic metamaterials from disordered networks
First-principles study of the layered thermoelectric material TiNBr
On the room-temperature aging effects in YBa2Cu3O6+d
Input-output theory for spin-photon coupling in Si double quantum dots
Relative Cooling Power Enhancement by Tuning Magneto-structural  Stability in Ni-Mn-In Heusler Alloys
Topological Terms and Phases of Sigma Models
Mobile fluxons as coherent probes of periodic pinning in superconductors
Identification of nickel-vacancy defect in the photocurrent spectrum of  diamond by means of \emph{ab initio} calculations
Elastic and electronic tuning of magnetoresistance in MoTe$_2$
Combined Machine Learning and CALPHAD Approach for Discovering  Processing-Structure Relationships in Soft Magnetic Alloys
High pressure x-ray study of spin-Peierls physics in the quantum spin  chain material TiOCl
Effect of multinary substitution on electronic and transport properties  of TiCoSb based half-Heusler alloys
Duality of deconfined quantum critical point in two dimensional Dirac  semimetals
Spin-density wave state in simple hexagonal graphite
A curious mapping between supersymmetric quantum chains
Bistability, oscillations and bidirectional motion of ensemble of  hydrodynamically-coupled molecular motors
Universal Spectral Correlations in the Chaotic Wave Function, and the  Development of Quantum Chaos
Dispersion in two dimensional channels - the Fick-Jacobs approximation  revisited
Dissecting spin-phonon equilibration in ferrimagnetic insulators by  ultrafast lattice excitation
Intrinsically shunted Josephson junctions for electronics applications
Coupled spin-charge dynamics in helical Fermi liquids beyond the random  phase approximation
Compressed H$_3$S: inter-sublattice Coulomb coupling in a  high-$\textit{T}$$_C$ superconductor
Brightening of the exciton ground state in carbon nanotubes in the  strong light-matter coupling regime
Topological superfluidity with repulsive alkaline-earth atoms in optical  lattices
